{
  "id": "accounting-operator",
  "display_name": "Accounting Operator",
  "version": "current",
  "description": "Episodic operator persona for closing accounting epochs: evidence capture, ownership classification (personal vs sole prop vs C-corp), and audit-ready exports. Not a bookkeeping system.",
  "asset_roots": {
    "profiles": "operator/profiles/accounting",
    "packs": "operator/packs/accounting",
    "notes": "operator/notes/accounting"
  },
  "docs": {
    "entrypoints": [
      {
        "title": "Profile README",
        "path": "docs/accounting/profile.md"
      },
      {
        "title": "Readiness",
        "path": "docs/accounting/readiness.md"
      },
      {
        "title": "Lifecycle",
        "path": "docs/accounting/lifecycle.md"
      },
      {
        "title": "Repo Launcher",
        "path": "docs/launcher.md"
      },
      {
        "title": "Accounting TUI Quick Guide",
        "path": "docs/accounting/tui-quick-guide.md"
      }
    ]
  },
  "required_receipts": [
    "receipt_bundle",
    "decision_record",
    "export_manifest"
  ],
  "capabilities": [
    "plan",
    "gate",
    "execute",
    "receipt",
    "export.csv",
    "backup.sync"
  ]
}
